{
  "contract": "brainbuddy.pre-freeze-writer-receipt/v1",
  "implementation_sha": "29411eba1fa0f6f13e54ec55b29635b1169100ff",
  "inventory": [
    ".env.example",
    ".github/workflows/ci.yml",
    ".github/workflows/deploy-fly-production.yml",
    ".gitleaks.toml",
    ".specify/gate-integrity.json",
    "Makefile",
    "backend/app/api/account.py",
    "backend/app/api/errors.py",
    "backend/app/api/modern_auth.py",
    "backend/app/cli.py",
    "backend/app/container.py",
    "backend/app/core/config.py",
    "backend/app/core/logging.py",
    "backend/app/main.py",
    "backend/app/repositories/auth_metadata.py",
    "backend/app/repositories/auth_store.py",
    "backend/app/repositories/session.py",
    "backend/app/repositories/user.py",
    "backend/app/schemas/auth.py",
    "backend/app/schemas/modern_auth.py",
    "backend/app/services/account_service.py",
    "backend/app/services/admin_service.py",
    "backend/app/services/auth_apple_lifecycle.py",
    "backend/app/services/auth_mail_service.py",
    "backend/app/services/auth_migration.py",
    "backend/app/services/auth_provider_service.py",
    "backend/app/services/auth_secret_box.py",
    "backend/app/services/auth_service.py",
    "backend/app/services/modern_auth_service.py",
    "backend/pyproject.toml",
    "backend/tests/allure_taxonomy.py",
    "backend/tests/conftest.py",
    "backend/tests/modern_auth_e2e_app.py",
    "backend/tests/test_account_api.py",
    "backend/tests/test_admin_deploy_contract.py",
    "backend/tests/test_admin_service.py",
    "backend/tests/test_api_contract.py",
    "backend/tests/test_auth_apple_lifecycle.py",
    "backend/tests/test_auth_legacy_atomic.py",
    "backend/tests/test_auth_logging.py",
    "backend/tests/test_auth_mail_service.py",
    "backend/tests/test_auth_migration.py",
    "backend/tests/test_auth_migration_integration.py",
    "backend/tests/test_auth_provider_service.py",
    "backend/tests/test_auth_secret_box.py",
    "backend/tests/test_auth_service.py",
    "backend/tests/test_auth_store.py",
    "backend/tests/test_branch_invariants.py",
    "backend/tests/test_modern_auth_api.py",
    "backend/tests/test_modern_auth_api_journeys.py",
    "backend/tests/test_modern_auth_apple_integration.py",
    "backend/tests/test_modern_auth_authority_edges.py",
    "backend/tests/test_modern_auth_authority_remaining.py",
    "backend/tests/test_modern_auth_config.py",
    "backend/tests/test_modern_auth_schemas.py",
    "backend/tests/test_modern_auth_service.py",
    "backend/tests/test_modern_auth_storage_remaining.py",
    "backend/tests/test_modern_auth_unlink_authority.py",
    "backend/tests/test_repository_and_cli_edges.py",
    "backend/uv.lock",
    "deploy/nginx/default.conf",
    "docs/api-compatibility.md",
    "docs/autonomous-delivery-runbook.md",
    "docs/data-retention.md",
    "docs/decisions/0028-modern-identity-authority.md",
    "docs/modern-auth-operations.md",
    "frontend/playwright.modern-auth.config.ts",
    "frontend/src/api/__tests__/account.test.ts",
    "frontend/src/api/__tests__/client.test.ts",
    "frontend/src/api/__tests__/modernAuth.remaining.test.ts",
    "frontend/src/api/__tests__/modernAuth.test.ts",
    "frontend/src/api/account.ts",
    "frontend/src/api/client.ts",
    "frontend/src/api/modernAuth.ts",
    "frontend/src/app/AppRoutes.test.tsx",
    "frontend/src/app/AppRoutes.tsx",
    "frontend/src/components/auth/ProtectedRoute.tsx",
    "frontend/src/components/auth/__tests__/ProtectedRoute.test.tsx",
    "frontend/src/features/account/AccountSettingsPage.tsx",
    "frontend/src/features/account/LegacyAccountActions.tsx",
    "frontend/src/features/account/__tests__/AccountSettingsPage.test.tsx",
    "frontend/src/features/account/__tests__/AuthMethods.test.tsx",
    "frontend/src/features/account/__tests__/LegacyAccountActions.test.tsx",
    "frontend/src/features/auth/AccountSecurity.tsx",
    "frontend/src/features/auth/AuthControls.tsx",
    "frontend/src/features/auth/AuthEntry.tsx",
    "frontend/src/features/auth/ConfirmAccount.tsx",
    "frontend/src/features/auth/ProviderCompletionPage.tsx",
    "frontend/src/features/auth/__tests__/ModernAuth.remaining.test.tsx",
    "frontend/src/features/auth/__tests__/ModernAuth.test.tsx",
    "frontend/src/features/auth/__tests__/ProviderCompletion.test.tsx",
    "frontend/src/features/auth/__tests__/authFlow.test.ts",
    "frontend/src/features/auth/authFlow.ts",
    "frontend/src/features/auth/authOperation.ts",
    "frontend/src/features/crt/__tests__/CrtWorkspace.test.tsx",
    "frontend/src/pages/LoginPage.tsx",
    "frontend/src/pages/PrivacyPolicyPage.tsx",
    "frontend/src/pages/SignupPage.tsx",
    "frontend/src/pages/__tests__/LoginPage.test.tsx",
    "frontend/src/pages/__tests__/PrivacyPolicyPage.test.tsx",
    "frontend/src/pages/__tests__/SignupPage.test.tsx",
    "frontend/tests/e2e/account.spec.ts",
    "frontend/tests/e2e/admin-users.spec.ts",
    "frontend/tests/e2e/auth.spec.ts",
    "frontend/tests/e2e/crt.spec.ts",
    "frontend/tests/e2e/gtdHelpers.ts",
    "frontend/tests/modern-auth.spec.ts",
    "frontend/tests/native-tasks-voice-brain-dump.compose.spec.ts",
    "ios/BrainBuddy/Screens/Settings/ModernAuthCoordinator.swift",
    "ios/BrainBuddy/Screens/Settings/SettingsScreen.swift",
    "ios/BrainBuddy/Screens/Settings/SignInSheet.swift",
    "ios/BrainBuddyKit/Sources/BrainBuddyAPI/NativeAuthCallback.swift",
    "ios/BrainBuddyKit/Sources/BrainBuddyAPI/NativeAuthentication.swift",
    "ios/BrainBuddyKit/Sources/BrainBuddySync/BrainBuddySync.swift",
    "ios/BrainBuddyKit/Sources/BrainBuddySync/SyncEngine+NativeAuthentication.swift",
    "ios/BrainBuddyKit/Sources/BrainBuddySync/SyncEngine.swift",
    "ios/BrainBuddyKit/Sources/BrainBuddyWorkspace/Workspace.swift",
    "ios/BrainBuddyKit/Tests/BrainBuddyAPITests/ModernAuthTests.swift",
    "ios/BrainBuddyKit/Tests/BrainBuddySyncTests/ModernAuthSessionTests.swift",
    "ios/BrainBuddyKit/Tests/BrainBuddyWorkspaceTests/WorkspaceModernAuthTests.swift",
    "ios/project.yml",
    "scripts/auth_migration_guard.py",
    "scripts/run_modern_auth_e2e.py",
    "scripts/test_auth_migration_guard.py",
    "specs/023-modern-auth/checklists/auth-quality.md",
    "specs/023-modern-auth/checklists/requirements.md",
    "specs/023-modern-auth/contracts/http-auth.md",
    "specs/023-modern-auth/contracts/native-auth.md",
    "specs/023-modern-auth/contracts/persistence-migration.md",
    "specs/023-modern-auth/data-model.md",
    "specs/023-modern-auth/design.md",
    "specs/023-modern-auth/design/apple-cleanup-pending.png",
    "specs/023-modern-auth/design/auth.html",
    "specs/023-modern-auth/design/completion-unknown.png",
    "specs/023-modern-auth/design/iphone-sign-in.png",
    "specs/023-modern-auth/design/overview.png",
    "specs/023-modern-auth/design/preview-check.json",
    "specs/023-modern-auth/design/reset-success.png",
    "specs/023-modern-auth/design/unlink-confirmation.png",
    "specs/023-modern-auth/intake.md",
    "specs/023-modern-auth/plan.md",
    "specs/023-modern-auth/planning-review.json",
    "specs/023-modern-auth/quickstart.md",
    "specs/023-modern-auth/renumbering-review.json",
    "specs/023-modern-auth/report.md",
    "specs/023-modern-auth/research.md",
    "specs/023-modern-auth/review-execution.md",
    "specs/023-modern-auth/reviews/c1-summary.json",
    "specs/023-modern-auth/reviews/c2-final/adversarial-high-risk.json",
    "specs/023-modern-auth/reviews/c2-final/architecture-consistency.json",
    "specs/023-modern-auth/reviews/c2-final/privacy-consent-security.json",
    "specs/023-modern-auth/reviews/c2-final/requirements-consistency.json",
    "specs/023-modern-auth/reviews/c2-final/testability-evidence.json",
    "specs/023-modern-auth/reviews/c2-final/ux-accessibility-mobile.json",
    "specs/023-modern-auth/reviews/c2-initial/adversarial-high-risk.json",
    "specs/023-modern-auth/reviews/c2-initial/architecture-consistency.json",
    "specs/023-modern-auth/reviews/c2-initial/privacy-consent-security.json",
    "specs/023-modern-auth/reviews/c2-initial/requirements-consistency.json",
    "specs/023-modern-auth/reviews/c2-initial/summary.json",
    "specs/023-modern-auth/reviews/c2-initial/testability-evidence.json",
    "specs/023-modern-auth/reviews/c2-initial/ux-accessibility-mobile.json",
    "specs/023-modern-auth/reviews/implementation-security-5fc4a6a.json",
    "specs/023-modern-auth/reviews/implementation-security-8f3adb83.json",
    "specs/023-modern-auth/reviews/implementation-security-e4e4eab3.json",
    "specs/023-modern-auth/spec.md",
    "specs/023-modern-auth/tasks.md",
    "specs/023-modern-auth/verification.md"
  ],
  "gates": [
    {
      "id": "writer.tests",
      "status": "PASS",
      "command": "make -j2 --eval='test-backend test-frontend: test-e2e' verify-all; SWIFT_IMAGE=brain-buddy-auth-swift-base-runtime:local sh ios/scripts/swift-linux.sh test",
      "observation": "Actual local294:4324 backend,1726 frontend,79 browser cases pass with one optional external-model skip; unchanged floors/taxonomy pass. Full Swift framework summary776tests/74suites pass, one opt-in live-backend endpoint skipped. Current public iOS app/kit CI and physical/live validation remain absent; local native runtime adaptation is documented.",
      "evidence": "evidence/local-29411eb/aggregate-summary.json; evidence/local-29411eb/native-summary.json; evidence/local-29411eb/native-input.json; verification.md"
    },
    {
      "id": "writer.verify_all",
      "status": "PASS",
      "command": "make -j2 --eval='test-backend test-frontend: test-e2e' verify-all",
      "observation": "Actual complete canonical local chain exited0 at294; all original targets/recipes/gates retained, browser first. Explicit candidate and same-source pinned images. No skipped required make target, floor reduction or timing-budget alteration.167 frozen feature paths verified unchanged after execution.",